"Status","Start Time","Stop Time","Duration in ms","Parent Suite","Suite","Sub Suite","Test Class","Test Method","Name","Description"
"passed","Thu Jun 06 09:10:10 UTC 2024","Thu Jun 06 09:10:43 UTC 2024","32542","Mason","mason_sb_myaccount_addresses_standardwithaddresses_auth.spec.js","Mason MyAccount - Addresses - Standard With Addresses","","","Account - Addresses - Set as Default Address - Verify if the 'Set as default billing & shipping address' checkbox is selected then newly added address gets updated as the Default Billing & Shipping Address upon save..",""
"broken","Thu Jun 06 09:08:37 UTC 2024","Thu Jun 06 09:10:08 UTC 2024","91778","Mason","mason_sb_myaccount_addresses_standardwithaddresses_auth.spec.js","Mason MyAccount - Addresses - Standard With Addresses","","","Account - Addresses - Remove and Undo Remove Address - Verify clicking on 'Remove' button, the selected address gets deleted and the data removed from the Addresses page.",""
"passed","Thu Jun 06 09:10:00 UTC 2024","Thu Jun 06 09:10:15 UTC 2024","14432","Mason","mason_sb_myaccount_addresses_standardwithaddresses_auth.spec.js","Mason MyAccount - Addresses - Standard With Addresses","","","Account - Addresses - Cancel Edit Address - Verify Cancel link is shown below the Save button and clicking on it, application collapses the Edit address form.",""
"failed","Thu Jun 06 09:08:37 UTC 2024","Thu Jun 06 09:09:00 UTC 2024","23678","Mason","mason_sb_myaccount_addresses_standardwithaddresses_auth.spec.js","Mason MyAccount - Addresses - Standard With Addresses","","","Account - Addresses - Standard With Addresses - Verify functionality of add new Address",""
"passed","Thu Jun 06 09:09:32 UTC 2024","Thu Jun 06 09:09:47 UTC 2024","14701","Mason","mason_sb_myaccount_addresses_standardwithaddresses_auth.spec.js","Mason MyAccount - Addresses - Standard With Addresses","","","Account - Addresses - Edit Address - Verify clicking on Save button, application validates (missing required field, invalid field) and shows an error message to user.",""
"passed","Thu Jun 06 09:09:02 UTC 2024","Thu Jun 06 09:09:19 UTC 2024","17040","Mason","mason_sb_myaccount_addresses_standardwithaddresses_auth.spec.js","Mason MyAccount - Addresses - Standard With Addresses","","","Account - Addresses - Edit Address - Verify clicking on Edit against any address, application expands edit address form with values pre-populated in it.",""
"passed","Thu Jun 06 09:09:47 UTC 2024","Thu Jun 06 09:10:00 UTC 2024","13543","Mason","mason_sb_myaccount_addresses_standardwithaddresses_auth.spec.js","Mason MyAccount - Addresses - Standard With Addresses","","","Account - Addresses - Add Address - Verify clicking on Save button, application validates (missing required field, invalid field) and shows an error message to user.",""
"passed","Thu Jun 06 09:09:19 UTC 2024","Thu Jun 06 09:09:32 UTC 2024","12878","Mason","mason_sb_myaccount_addresses_standardwithaddresses_auth.spec.js","Mason MyAccount - Addresses - Standard With Addresses","","","Account - Addresses - Edit Address - Verify Address Line 2 (optional) field is collapsed upon load when data is not present.",""
